{
  "$schema": "https://json-schema.org/draft/2020-12/schema",
  "$id": "https://home-infra-protocol.example/schemas/status-snapshot.schema.json",
  "title": "Home Infra Protocol Status Snapshot",
  "description": "Sanitized runtime telemetry output published by a project-owned Telemetry Source. The snapshot records what the producer observed; consumers derive freshness by joining observed_at with the job declaration's stale_after.",
  "type": "object",
  "required": ["observed_at", "condition", "severity", "summary"],
  "additionalProperties": true,
  "properties": {
    "observed_at": {
      "type": "string",
      "format": "date-time",
      "pattern": "^\\d{4}-\\d{2}-\\d{2}T\\d{2}:\\d{2}:\\d{2}(?:\\.\\d+)?Z$",
      "description": "UTC RFC3339 timestamp for when the producer observed or completed the check. Producers MUST write this; consumers derive freshness from it."
    },
    "next_run_at": {
      "type": "string",
      "format": "date-time",
      "pattern": "^\\d{4}-\\d{2}-\\d{2}T\\d{2}:\\d{2}:\\d{2}(?:\\.\\d+)?Z$",
      "description": "Optional UTC RFC3339 timestamp for the next execution planned by the producer's scheduler. Consumers may render it as an attributed countdown but MUST NOT derive lateness, freshness, or incidents from it. Producers omit it when no authoritative next execution is known."
    },
    "condition": {
      "$ref": "#/$defs/top_level_condition"
    },
    "severity": {
      "$ref": "#/$defs/severity"
    },
    "summary": {
      "type": "string",
      "minLength": 1,
      "description": "Display-only human summary. It SHOULD be a plain-language operator statement rather than an internal field name or key=value expression. Consumers MUST NOT parse this field for logic."
    },
    "checks": {
      "type": "array",
      "items": {
        "$ref": "#/$defs/check"
      },
      "description": "Optional shaped sub-checks, for example one check per account or upstream. The top-level snapshot remains the producer's aggregate view."
    },
    "capabilities": {
      "type": "array",
      "items": {
        "$ref": "#/$defs/capability_observation"
      },
      "description": "Optional runtime evidence for capabilities declared by the owning project contract. Policy never belongs in this snapshot."
    }
  },
  "$defs": {
    "top_level_condition": {
      "type": "string",
      "enum": ["ok", "degraded"],
      "description": "Producer-emitted aggregate condition. Producers emit only ok or degraded; consumers derive unknown/down from absence, unreadability, or staleness."
    },
    "check_condition": {
      "type": "string",
      "enum": ["ok", "degraded", "down"],
      "description": "Sub-check condition. Unlike the top-level producer condition, a producer may mark an individual sub-check down while the aggregate remains degraded."
    },
    "severity": {
      "type": "string",
      "enum": ["none", "info", "watch", "warning", "critical"],
      "description": "Producer-recommended ordered severity: none=0, info=1, watch=2, warning=3, critical=4. Consumers apply policy on top of this recommendation."
    },
    "check": {
      "type": "object",
      "required": ["name", "condition"],
      "additionalProperties": true,
      "properties": {
        "name": {
          "type": "string",
          "minLength": 1,
          "description": "Stable machine-readable check identifier. Consumers MUST use this field for joins and logic and SHOULD prefer label for display when label is present."
        },
        "label": {
          "type": "string",
          "minLength": 1,
          "maxLength": 80,
          "description": "Optional concise human-facing check label. Producers SHOULD provide it when the stable name would expose implementation syntax or jargon in an operator UI."
        },
        "condition": {
          "$ref": "#/$defs/check_condition"
        },
        "severity": {
          "$ref": "#/$defs/severity"
        },
        "summary": {
          "type": "string",
          "description": "Display-only human summary for the sub-check. It SHOULD be a plain-language statement rather than an internal field name or key=value expression. Consumers MUST NOT parse this field for logic."
        }
      }
    },
    "capability_observation": {
      "type": "object",
      "required": ["id", "availability"],
      "additionalProperties": true,
      "properties": {
        "id": {
          "type": "string",
          "pattern": "^[a-z0-9](?:[a-z0-9.-]*[a-z0-9])?$",
          "maxLength": 120
        },
        "availability": {
          "type": "string",
          "enum": ["available", "unavailable", "degraded", "unknown"]
        },
        "verification": {
          "type": "string",
          "enum": [
            "declared",
            "implemented",
            "built",
            "transferred",
            "running",
            "serving"
          ],
          "description": "Highest deployment-lifecycle state supported by current evidence."
        },
        "summary": {
          "type": "string",
          "minLength": 1,
          "maxLength": 240,
          "description": "Sanitized display-only observation. Consumers must not parse it for availability or policy."
        }
      }
    }
  }
}
